id,text_clean
Art. 227.,centralnym bankiem panstwo narodowy bank przysługuje wyłączne prawo emisji pieniądza ustalania realizowania polityki pieniężnej narodowy bank odpowiedzialnosc wartość polskiego pieniądza organami narodowego banku polskiego prezes narodowego banku polskiego rada polityki pieniężnej zarząd narodowego banku polskiego prezes narodowego banku polskiego powoływany sejm wniosek prezydenta ©kancelaria prezes narodowego banku polskiego nie moze należeć partii politycznej związku zawodowego prowadzić działalności publicznej nie dającej pogodzić godnosc urzędu skład rady polityki pieniężnej wchodzą prezes narodowego banku polskiego przewodniczący osoby wyróżniające wiedzą zakresu finansów powoływane rownosc liczbie prezydenta sejm senat rada polityki pieniężnej ustala corocznie założenia polityki pieniężnej przedkłada wiadomości sejmowi równocześnie przedłożeniem radę ministrów projektu ustawa budżetowej rada polityki pieniężnej ciągu miesięcy zakończenia budżetowego składa sejmowi sprawozdanie wykonania założeń polityki pieniężnej organizację zasady działania narodowego banku polskiego szczegółowe zasady powoływania odwoływania organów określa ustawa rozdział stany nadzwyczajne
Art. 228.,sytuacjach szczególnych zagrożeń zwykłe środki konstytucyjne niewystarczające moze zostać wprowadzony odpowiedni stan nadzwyczajny stan wojenny stan wyjątkowy stan klęski żywiołowej stan nadzwyczajny moze wprowadzony ustawa drodze rozporządzenia podlega dodatkowemu podaniu publicznej wiadomości zasady działania organów władzy publicznej zakres jakim zostać ograniczenie wolnosc prawo czlowiek obywatel czasie poszczególnych stanów nadzwyczajnych określa ustawa ustawa moze określić podstawy zakres tryb wyrównywania strat majątkowych wynikających ograniczenie czasie stanu nadzwyczajnego wolnosc prawo czlowiek obywatel działania podjęte wyniku wprowadzenia stanu nadzwyczajnego musi odpowiadać stopniowi zagrożenia musi zmierzać najszybszego przywrócenia normalnego funkcjonowania panstwo ©kancelaria czasie stanu nadzwyczajnego nie zmienione ordynacje wyborcze senatu organów samorządu terytorialnego ustawa wyborze prezydenta ustawa stanach nadzwyczajnych czasie stanu nadzwyczajnego ciągu dni zakończeniu nie moze skrócona kadencja przeprowadzane referendum ogólnokrajowe nie przeprowadzane wybory senatu organów samorządu terytorialnego wybory prezydenta kadencje organów ulegają odpowiedniemu przedłużeniu wybory organów samorządu terytorialnego nie wprowadzony stan nadzwyczajny
Art. 229.,zewnętrznego zagrożenia panstwo zbrojnej napaści terytorium umowy międzynarodowej wynika zobowiązanie wspólnej obrony przeciwko agresji prezydent wniosek rady ministrów moze wprowadzić stan wojenny części całym terytorium panstwo
Art. 230.,zagrożenia konstytucyjnego ustroju panstwo bezpieczeństwa obywatel porządku publicznego prezydent wniosek rady ministrów moze wprowadzić czas oznaczony nie dłuższy dni stan wyjątkowy części całym terytorium panstwo przedłużenie stanu wyjątkowego moze nastąpić zgodą czas nie dłuższy dni
Art. 231.,rozporządzenie wprowadzeniu stanu wojennego wyjątkowego prezydent przedstawia sejmowi ciągu godzin podpisania rozporządzenia sejm niezwłocznie rozpatruje rozporządzenie prezydenta sejm moze uchylić bezwzględną większością głosów obecności najmniej połowy ustawa liczby posłów
Art. 232.,celu zapobieżenia skutkom katastrof naturalnych awarii technicznych noszących znamiona klęski żywiołowej celu usunięcia rada ministrów moze wprowadzić czas oznaczony nie dłuższy dni stan klęski żywiołowej części całym terytorium panstwo przedłużenie stanu moze nastąpić zgodą
Art. 233.,ustawa określająca zakres ograniczenie wolnosc prawo czlowiek obywatel czasie stanu wojennego wyjątkowego nie moze ograniczenie wolnosc ©kancelaria prawo określonych godnosc czlowiek obywatel ochrona życia humanitarne traktowanie ponoszenie odpowiedzialnosc karnej dostęp sad dobra osobiste sumienie religia petycje rodzina dziecko niedopuszczalne ograniczenie wolnosc prawo czlowiek obywatel wyłącznie powodu rasy płci języka wyznania braku pochodzenia społecznego urodzenia majątku ustawa określająca zakres ograniczenie wolnosc prawo czlowiek obywatel stanie klęski żywiołowej moze ograniczenie wolnosc prawo określone wolnosc działalności gospodarczej wolnosc osobista nienaruszalność mieszkania wolnosc poruszania pobytu terytorium prawo strajku prawo wlasnosc wolnosc pracy prawo bezpiecznych higienicznych warunków pracy prawo wypoczynku
Art. 234.,czasie stanu wojennego sejm nie moze zebrać posiedzenie prezydent wniosek rady ministrów wydaje rozporządzenia mocą ustawa zakresie granicach określonych rozporządzenia podlegają zatwierdzeniu sejm najbliższym posiedzeniu rozporządzenia mowa charakter źródeł powszechnie obowiązującego prawo rozdział zmiana konstytucji
Art. 235.,projekt ustawa zmianie konstytucji moze przedłożyć najmniej ustawa liczby posłów senat prezydent zmiana konstytucji następuje drodze ustawa uchwalonej jednakowym brzmieniu sejm następnie terminie nie dłuższym dni senat pierwsze czytanie projektu ustawa zmianie konstytucji moze odbyć nie wcześniej trzydziestego przedłożenia sejmowi projektu ustawa ©kancelaria ustawę zmianie konstytucji uchwala sejm większością najmniej głosów obecności najmniej połowy ustawa liczby posłów senat bezwzględną większością głosów obecności najmniej połowy ustawa liczby senatorów uchwalenie sejm ustawa zmieniającej przepisy rozdziałów konstytucji moze odbyć nie wcześniej sześćdziesiątego pierwszym czytaniu projektu ustawa ustawa zmianie konstytucji dotyczy przepisów rozdziału podmioty określone zażądać terminie dni uchwalenia ustawa senat przeprowadzenia referendum zatwierdzającego wnioskiem sprawie podmioty zwracają marszałka zarządza niezwłocznie przeprowadzenie referendum ciągu dni złożenia wniosku zmiana konstytucji zostaje przyjęta tą zmianą opowiedziała większość głosujących zakończeniu postępowania określonego marszałek przedstawia prezydentowi uchwaloną ustawę podpisu prezydent podpisuje ustawę ciągu dni przedstawienia zarządza ogłoszenie dzienniku ustawa rozdział przepisy przejściowe końcowe
Art. 236.,okresie wejścia życie konstytucji rada ministrów przedstawi sejmowi projekty ustawa niezbędnych stosowania konstytucji ustawa wprowadzające życie zakresie dotyczącym postępowania sad administracyjnymi zostaną uchwalone upływem wejścia życie konstytucji czasu wejścia życie ustawa obowiazany przepisy dotyczące rewizji nadzwyczajnej orzeczeń naczelnego sad administracyjnego
Art. 237.,okresie wejścia życie konstytucji sprawach wykroczenia orzekają kolegia spraw wykroczeń sądach rejonowych czym kara aresztu orzeka sad odwołanie orzeczenia kolegium rozpoznaje sad ©kancelaria
Art. 238.,kadencja konstytucyjnych organów władzy publicznej osób wchodzących skład wybranych powołanych wejściem życie konstytucji kończy upływem okresu ustalonego przepisach obowiązujących dniem wejścia życie konstytucji przypadku przepisy obowiązujące dniem wejścia życie konstytucji nie ustalały kadencji wyboru powołania upłynął okres dłuższy ustalony konstytucję kadencja konstytucyjna organów władzy publicznej osób wchodzących skład upływa wejścia życie konstytucji przypadku przepisy obowiązujące dniem wejścia życie konstytucji nie ustalały kadencji wyboru powołania upłynął okres krótszy ustalony konstytucję konstytucyjnych organów władzy publicznej osób wchodzących skład czas organy osoby pełniły funkcje przepisów dotychczasowych wlicza kadencji ustalonej konstytucji
Art. 239.,okresie wejścia życie konstytucji orzeczenia trybunal konstytucyjnego niezgodności konstytucją ustawa uchwalonych dniem wejścia życie nie ostateczne podlegają rozpatrzeniu sejm moze odrzucić orzeczenie trybunal konstytucyjnego większością głosów obecności najmniej połowy ustawa liczby posłów nie dotyczy orzeczeń wydanych następstwie pytań prawo trybunal konstytucyjnego postępowanie sprawach ustalenie trybunal konstytucyjny powszechnie obowiązującej wykładni ustawa wszczęte wejściem życie konstytucji podlega umorzeniu dniem wejścia życie konstytucji uchwały trybunal konstytucyjnego sprawie ustalenia wykładni ustawa tracą moc powszechnie obowiązującą mocy pozostają prawomocne wyroki sad prawomocne decyzje organów władzy publicznej podjęte uwzględnieniem znaczenia przepisów ustalonego trybunal konstytucyjny drodze powszechnie obowiązującej wykładni ustawa
Art. 240.,okresie wejścia życie konstytucji ustawa budżetowa moze przewidywać pokrywanie deficytu budżetowego zaciąganie zobowiązań centralnym banku panstwo ©kancelaria
Art. 241.,umowy międzynarodowe ratyfikowane dotychczas rzeczpospolitą polską obowiązujących czasie ratyfikacji przepisów konstytucyjnych ogłoszone dzienniku ustawa uznaje umowy ratyfikowane uprzednią zgodą wyrażoną ustawa stosuje przepisy konstytucji treści umowy międzynarodowej wynika dotyczą kategorii spraw wymienionych konstytucji rada ministrów ciągu wejścia życie konstytucji przedstawi sejmowi wykaz umów międzynarodowych zawierających postanowienia niezgodne konstytucją senatorowie wybrani dniem wejścia życie konstytucji nie ukończyli zachowują mandaty końca kadencji którą zostali wybrani połączenie mandatu posła senatora funkcją zatrudnieniem dotyczy zakaz określony powoduje wygaśnięcie mandatu upływie miesiąca wejścia życie konstytucji chyba poseł senator wcześniej zrzeknie funkcji ustanie zatrudnienie sprawy będące przedmiotem postępowania ustawodawczego trybunal konstytucyjnym bądź trybunal stanu rozpoczęte wejściem życie konstytucji prowadzone zgodnie przepisami konstytucyjnymi obowiązującymi dniu rozpoczęcia sprawy okresie wejścia życie konstytucji rada ministrów ustali uchwał rady ministrów zarządzeń ministrów organów administracji rządowej podjęte wydane dniem wejścia życie konstytucji wymagają stosownie warunków określonych konstytucji zastąpienia rozporządzenia wydane upoważnienia ustawa projekt odpowiednim czasie rada ministrów przedstawi sejmowi samym okresie rada ministrów przedstawi sejmowi projekt ustawa określającej akty normatywne organów administracji rządowej wydane dniem wejścia życie konstytucji stają uchwałami zarządzeniami rozumieniu konstytucji obowiązujące dniu wejścia życie konstytucji akty prawo miejscowego przepisy gminne stają aktami prawo miejscowego rozumieniu konstytucji ©kancelaria
Art. 242.,tracą moc ustawa konstytucyjna października wzajemnych stosunkach władzą ustawodawczą wykonawczą samorządzie terytorialnym ustawa konstytucyjna kwietnia trybie przygotowania uchwalenia konstytucji
Art. 243.,wchodzi życie upływie miesięcy ogłoszenia
