id,text_clean
Art. 153.,celu zapewnienia zawodowego rzetelnego bezstronnego politycznie neutralnego wykonywania zadań panstwo urzędach administracji rządowej działa korpus służby cywilnej prezes rady ministrów zwierzchnikiem korpusu służby cywilnej ©kancelaria
Art. 154.,prezydent desygnuje prezesa rady ministrów proponuje skład rady ministrów prezydent powołuje prezesa rady ministrów wraz pozostałymi członkami rady ministrów ciągu dni pierwszego posiedzenia przyjęcia dymisji poprzedniej rady ministrów odbiera przysięgę członków nowo powołanej rady ministrów prezes rady ministrów ciągu dni powołania prezydenta przedstawia sejmowi program działania rady ministrów wnioskiem udzielenie wotum zaufania wotum zaufania sejm uchwala bezwzględną większością głosów obecności najmniej połowy ustawa liczby posłów niepowołania rady ministrów trybie nieudzielenia wotum zaufania trybie sejm ciągu dni upływu terminów określonych wybiera prezesa rady ministrów proponowanych członków rady ministrów bezwzględną większością głosów obecności najmniej połowy ustawa liczby posłów prezydent powołuje wybraną radę ministrów odbiera przysięgę członków
Art. 155.,niepowołania rady ministrów trybie prezydent ciągu dni powołuje prezesa rady ministrów wniosek pozostałych członków rady ministrów odbiera przysięgę sejm ciągu dni powołania rady ministrów prezydenta udziela wotum zaufania większością głosów obecności najmniej połowy ustawa liczby posłów nieudzielenia radzie ministrów wotum zaufania trybie określonym prezydent skraca kadencję zarządza wybory
Art. 156.,członkowie rady ministrów ponoszą odpowiedzialnosc trybunal stanu naruszenie konstytucji ustawa przestępstwa popełnione związku zajmowanym stanowiskiem uchwałę pociągnięciu członka rady ministrów odpowiedzialnosc trybunal stanu sejm podejmuje wniosek prezydenta najmniej posłów większością ustawa liczby posłów ©kancelaria
Art. 157.,członkowie rady ministrów ponoszą sejmem solidarną odpowiedzialnosc działalność rady ministrów członkowie rady ministrów ponoszą sejmem odpowiedzialnosc indywidualną sprawy należące kompetencji powierzone prezesa rady ministrów
Art. 158.,sejm wyraża radzie ministrów wotum nieufności większością ustawa liczby posłów wniosek zgłoszony najmniej posłów wskazujący imiennie kandydata prezesa rady ministrów uchwała została przyjęta sejm prezydent przyjmuje dymisję rady ministrów powołuje wybranego sejm nowego prezesa rady ministrów wniosek pozostałych członków rady ministrów odbiera przysięgę wniosek podjęcie uchwały mowa moze poddany głosowanie nie wcześniej upływie dni zgłoszenia powtórny wniosek moze zgłoszony nie wcześniej upływie miesięcy zgłoszenia poprzedniego wniosku powtórny wniosek moze zgłoszony upływem miesięcy wystąpi najmniej posłów
Art. 159.,sejm moze wyrazić ministrowi wotum nieufności wniosek wyrażenie wotum nieufności moze zgłoszony najmniej posłów przepis stosuje odpowiednio prezydent odwołuje ministra któremu sejm wyraził wotum nieufności większością głosów ustawa liczby posłów
Art. 160.,prezes rady ministrów moze zwrócić wyrażenie radzie ministrów wotum zaufania udzielenie wotum zaufania radzie ministrów następuje większością głosów obecności najmniej połowy ustawa liczby posłów
Art. 161.,prezydent wniosek prezesa rady ministrów dokonuje zmian składzie rady ministrów
Art. 162.,prezes rady ministrów składa dymisję rady ministrów pierwszym posiedzeniu nowo wybranego prezes rady ministrów składa dymisję rady ministrów nieuchwalenia sejm wotum zaufania rady ministrów wyrażenia radzie ministrów wotum nieufności ©kancelaria rezygnacji prezesa rady ministrów prezydent przyjmując dymisję rady ministrów powierza dalsze sprawowanie obowiazek czasu powołania nowej rady ministrów prezydent przypadku określonym moze odmówić przyjęcia dymisji rady ministrów rozdział samorząd terytorialny
Art. 163.,samorząd terytorialny wykonuje zadania publiczne nie zastrzeżone konstytucję ustawa organów władz publicznych
Art. 164.,podstawową jednostką samorządu terytorialnego gmina jednostki samorządu regionalnego lokalnego regionalnego określa ustawa gmina wykonuje zadania samorządu terytorialnego nie zastrzeżone jednostek samorządu terytorialnego
Art. 165.,jednostki samorządu terytorialnego osobowość prawną przysługują prawo wlasnosc prawo majątkowe samodzielność jednostek samorządu terytorialnego podlega ochrona sad
Art. 166.,zadania publiczne służące zaspokajaniu potrzeb wspólnoty samorządowej wykonywane jednostkę samorządu terytorialnego zadania wlasnosc wynika uzasadnionych potrzeb panstwo ustawa moze zlecić jednostkom samorządu terytorialnego wykonywanie zadań publicznych ustawa określa tryb przekazywania wykonywania zadań zleconych spory kompetencyjne organami samorządu terytorialnego administracji rządowej rozstrzygają sad administracyjne
Art. 167.,jednostkom samorządu terytorialnego zapewnia udział dochodach publicznych odpowiednio przypadających zadań dochodami jednostek samorządu terytorialnego dochody wlasnosc subwencje ogólne dotacje celowe budżetu panstwo ©kancelaria źródła dochodów jednostek samorządu terytorialnego określone ustawa zmiany zakresie zadań kompetencji jednostek samorządu terytorialnego następują wraz odpowiednimi zmianami podziale dochodów publicznych
Art. 168.,jednostki samorządu terytorialnego prawo ustalania wysokości podatków opłat lokalnych zakresie określonym ustawa
Art. 169.,jednostki samorządu terytorialnego wykonują zadania pośrednictwem organów stanowiących wykonawczych wybory organów stanowiących powszechne rownosc bezpośrednie odbywają głosowaniu tajnym zasady tryb zgłaszania kandydatów przeprowadzania wyborów warunki ważności wyborów określa ustawa zasady tryb wyborów odwoływania organów wykonawczych jednostek samorządu terytorialnego określa ustawa ustrój wewnętrzny jednostek samorządu terytorialnego określają granicach ustawa organy stanowiące
Art. 170.,członkowie wspólnoty samorządowej decydować drodze referendum sprawach dotyczących wspólnoty odwołaniu pochodzącego wyborów bezpośrednich organu samorządu terytorialnego zasady tryb przeprowadzania referendum lokalnego określa ustawa
Art. 171.,działalność samorządu terytorialnego podlega nadzorowi punktu widzenia legalności organami nadzoru działalnością jednostek samorządu terytorialnego prezes rady ministrów wojewodowie zakresie spraw finansowych regionalne izby obrachunkowe sejm wniosek prezesa rady ministrów moze rozwiązać organ stanowiący samorządu terytorialnego organ rażąco narusza konstytucję ustawa
Art. 172.,jednostki samorządu terytorialnego prawo zrzeszania jednostka samorządu terytorialnego prawo przystępowania międzynarodowych zrzeszeń społeczności lokalnych regionalnych współpracy społecznościami lokalnymi regionalnymi państw ©kancelaria zasady jakich jednostki samorządu terytorialnego korzystać prawo mowa określa ustawa rozdział sad trybunal
Art. 173.,sad trybunal władzą odrębną niezależną władz
Art. 174.,sad trybunal wydają wyroki imieniu sad
Art. 175.,wymiar sprawiedliwości sprawują sad najwyższy sad powszechne sad administracyjne sad wojskowe sad wyjątkowy tryb doraźny moze ustanowiony czas wojny
Art. 176.,postępowanie sad najmniej dwuinstancyjne ustrój właściwość sad postępowanie sad określają ustawa
Art. 177.,sad powszechne sprawują wymiar sprawiedliwości sprawach wyjątkiem spraw ustawowo zastrzeżonych właściwości sad
Art. 178.,sędziowie sprawowaniu swojego urzędu niezawiśli podlegają konstytucji ustawa sędziom zapewnia warunki pracy wynagrodzenie odpowiadające godnosc urzędu zakresowi obowiazek sędzia nie moze należeć partii politycznej związku zawodowego prowadzić działalności publicznej nie dającej pogodzić zasadami niezależności sad niezawisłości sędziów
Art. 179.,sędziowie powoływani prezydenta wniosek krajowej rady sądownictwa czas nieoznaczony
Art. 180.,sędziowie nieusuwalni złożenie sędziego urzędu zawieszenie urzędowaniu przeniesienie innej siedziby stanowisko wbrew woli moze nastąpić mocy orzeczenia sad przypadkach określonych ustawa ©kancelaria sędzia moze przeniesiony stan spoczynku skutek uniemożliwiających sprawowanie urzędu choroby utraty sił tryb postępowania odwołania sad określa ustawa ustawa określa granicę wieku osiągnięciu sędziowie przechodzą stan spoczynku zmiany ustroju sad zmiany granic okręgów sad wolnosc sędziego przenosić innego sad stan spoczynku pozostawieniem pełnego uposażenia
Art. 181.,sędzia nie moze uprzedniej zgody sad określonego ustawa pociągnięty odpowiedzialnosc karnej pozbawiony wolnosc sędzia nie moze zatrzymany aresztowany wyjątkiem ujęcia gorącym uczynku przestępstwa zatrzymanie niezbędne zapewnienia prawidłowego toku postępowania zatrzymaniu niezwłocznie powiadamia prezesa właściwego miejscowo sad moze nakazać natychmiastowe zwolnienie zatrzymanego
Art. 182.,udział obywatel sprawowaniu wymiaru sprawiedliwości określa ustawa
Art. 183.,sad najwyższy sprawuje nadzór działalnością sad powszechnych wojskowych zakresie orzekania sad najwyższy wykonuje czynności określone konstytucji ustawa pierwszego prezesa sad najwyższego powołuje prezydent sześcioletnią kadencję spośród kandydatów przedstawionych zgromadzenie ogólne sędziów sad najwyższego
Art. 184.,naczelny sad administracyjny sad administracyjne sprawują zakresie określonym ustawa kontrolę działalności administracji publicznej kontrola obejmuje orzekanie zgodności ustawa uchwał organów samorządu terytorialnego aktów normatywnych terenowych organów administracji rządowej
Art. 185.,prezesa naczelnego sad administracyjnego powołuje prezydent sześcioletnią kadencję spośród kandydatów przedstawionych zgromadzenie ogólne sędziów naczelnego sad administracyjnego ©kancelaria
Art. 186.,krajowa rada sądownictwa stoi straży niezależności sad niezawisłości sędziów krajowa rada sądownictwa moze wystąpić trybunal konstytucyjnego wnioskiem sprawie zgodności konstytucją aktów normatywnych zakresie jakim dotyczą niezależności sad niezawisłości sędziów
Art. 187.,krajowa rada sądownictwa składa pierwszego prezesa sad najwyższego ministra sprawiedliwości prezesa naczelnego sad administracyjnego osoby powołanej prezydenta piętnastu członków wybranych spośród sędziów sad najwyższego sad powszechnych sad administracyjnych sad wojskowych czterech członków wybranych sejm spośród posłów dwóch członków wybranych senat spośród senatorów krajowa rada sądownictwa wybiera spośród swoich członków przewodniczącego dwóch wiceprzewodniczących kadencja wybranych członków krajowej rady sądownictwa trwa cztery lata ustrój zakres działania tryb pracy krajowej rady sądownictwa wyboru członków określa ustawa trybunal konstytucyjny
Art. 188.,trybunal konstytucyjny orzeka sprawach zgodności ustawa umów międzynarodowych konstytucją zgodności ustawa ratyfikowanymi umowami międzynarodowymi ratyfikacja wymagała uprzedniej zgody wyrażonej ustawa zgodności przepisów prawo wydawanych centralne organy panstwo konstytucją ratyfikowanymi umowami międzynarodowymi ustawa zgodności konstytucją celów działalności partii politycznych skargi konstytucyjnej mowa
Art. 189.,trybunal konstytucyjny rozstrzyga spory kompetencyjne pomiędzy centralnymi konstytucyjnymi organami panstwo
Art. 190.,orzeczenia trybunal konstytucyjnego moc powszechnie obowiązującą ostateczne ©kancelaria orzeczenia trybunal konstytucyjnego sprawach wymienionych podlegają niezwłocznemu ogłoszeniu organie urzędowym akt normatywny ogłoszony akt nie ogłoszony orzeczenie ogłasza dzienniku urzędowym monitor orzeczenie trybunal konstytucyjnego wchodzi życie dniem ogłoszenia trybunal konstytucyjny moze określić termin utraty mocy obowiązującej aktu normatywnego termin nie moze przekroczyć osiemnastu miesięcy chodzi ustawę chodzi akt normatywny dwunastu miesięcy przypadku orzeczeń wiążą nakładami finansowymi nie przewidzianymi ustawa budżetowej trybunal konstytucyjny określa termin utraty mocy obowiązującej aktu normatywnego zapoznaniu opinią rady ministrów orzeczenie trybunal konstytucyjnego niezgodności konstytucją umową międzynarodową ustawa aktu normatywnego zostało wydane prawomocne orzeczenie sad ostateczna decyzja administracyjna rozstrzygnięcie sprawach stanowi podstawę wznowienia postępowania uchylenia decyzji innego rozstrzygnięcia zasadach trybie określonych przepisach właściwych danego postępowania orzeczenia trybunal konstytucyjnego zapadają większością głosów
Art. 191.,wnioskiem sprawach mowa trybunal konstytucyjnego wystąpić prezydent marszałek marszałek senatu prezes rady ministrów posłów senatorów pierwszy prezes sad najwyższego prezes naczelnego sad administracyjnego prokurator generalny prezes najwyższej izby kontroli rzecznik prawo obywatel krajowa rada sądownictwa zakresie mowa organy stanowiące jednostek samorządu terytorialnego ogólnokrajowe organy związków zawodowych ogólnokrajowe władze organizacji pracodawców organizacji zawodowych kościoły związki wyznaniowe podmioty określone zakresie wskazanym podmioty mowa wystąpić takim wnioskiem akt normatywny dotyczy spraw objętych zakresem działania ©kancelaria
Art. 192.,wnioskiem sprawach mowa trybunal konstytucyjnego wystąpić prezydent marszałek marszałek senatu prezes rady ministrów pierwszy prezes sad najwyższego prezes naczelnego sad administracyjnego prezes najwyższej izby kontroli
Art. 193.,sad moze przedstawić trybunal konstytucyjnemu pytanie prawo zgodności aktu normatywnego konstytucją ratyfikowanymi umowami międzynarodowymi ustawa odpowiedzi pytanie prawo zależy rozstrzygnięcie sprawy toczącej sad
Art. 194.,trybunal konstytucyjny składa sędziów wybieranych indywidualnie sejm spośród osób wyróżniających wiedzą prawniczą ponowny wybór składu trybunal niedopuszczalny prezesa wiceprezesa trybunal konstytucyjnego powołuje prezydent spośród kandydatów przedstawionych zgromadzenie ogólne sędziów trybunal konstytucyjnego
Art. 195.,sędziowie trybunal konstytucyjnego sprawowaniu swojego urzędu niezawiśli podlegają konstytucji sędziom trybunal konstytucyjnego zapewnia warunki pracy wynagrodzenie odpowiadające godnosc urzędu zakresowi obowiazek sędziowie trybunal konstytucyjnego okresie zajmowania stanowiska nie należeć partii politycznej związku zawodowego prowadzić działalności publicznej nie dającej pogodzić zasadami niezależności sad niezawisłości sędziów
Art. 196.,sędzia trybunal konstytucyjnego nie moze uprzedniej zgody trybunal konstytucyjnego pociągnięty odpowiedzialnosc karnej pozbawiony wolnosc sędzia nie moze zatrzymany aresztowany wyjątkiem ujęcia gorącym uczynku przestępstwa zatrzymanie niezbędne zapewnienia prawidłowego toku postępowania zatrzymaniu niezwłocznie powiadamia prezesa trybunal konstytucyjnego moze nakazać natychmiastowe zwolnienie zatrzymanego
Art. 197.,organizację trybunal konstytucyjnego tryb postępowania trybunal określa ustawa ©kancelaria trybunal stanu
Art. 198.,naruszenie konstytucji ustawa związku zajmowanym stanowiskiem zakresie swojego urzędowania odpowiedzialnosc konstytucyjną trybunal stanu ponoszą prezydent prezes rady ministrów członkowie rady ministrów prezes narodowego banku polskiego prezes najwyższej izby kontroli członkowie krajowej rady radiofonii telewizji osoby prezes rady ministrów powierzył kierowanie ministerstwem naczelny dowódca sił zbrojnych odpowiedzialnosc konstytucyjną trybunal stanu ponoszą posłowie senatorowie zakresie określonym rodzaje kara orzekanych trybunal stanu określa ustawa
Art. 199.,trybunal stanu składa przewodniczącego zastępców przewodniczącego członków wybieranych sejm spoza grona posłów senatorów czas kadencji zastępcy przewodniczącego trybunal najmniej połowa członków trybunal stanu mieć kwalifikacje wymagane zajmowania stanowiska sędziego przewodniczącym trybunal stanu pierwszy prezes sad najwyższego członkowie trybunal stanu sprawowaniu funkcji sędziego trybunal stanu niezawiśli podlegają konstytucji ustawa
Art. 200.,członek trybunal stanu nie moze uprzedniej zgody trybunal stanu pociągnięty odpowiedzialnosc karnej pozbawiony wolnosc członek trybunal stanu nie moze zatrzymany aresztowany wyjątkiem ujęcia gorącym uczynku przestępstwa zatrzymanie niezbędne zapewnienia prawidłowego toku postępowania zatrzymaniu niezwłocznie powiadamia przewodniczącego trybunal stanu moze nakazać natychmiastowe zwolnienie zatrzymanego
Art. 201.,organizację trybunal stanu tryb postępowania trybunal określa ustawa ©kancelaria rozdział organy kontroli panstwo ochrona prawo najwyższa izba kontroli
Art. 202.,najwyższa izba kontroli naczelnym organem kontroli panstwo najwyższa izba kontroli podlega sejmowi najwyższa izba kontroli działa zasadach kolegialności
Art. 203.,najwyższa izba kontroli kontroluje działalność organów administracji rządowej narodowego banku polskiego panstwo osób prawo panstwo jednostek organizacyjnych punktu widzenia legalności gospodarności celowości rzetelności najwyższa izba kontroli moze kontrolować działalność organów samorządu terytorialnego komunalnych osób prawo komunalnych jednostek organizacyjnych punktu widzenia legalności gospodarności rzetelności najwyższa izba kontroli moze kontrolować punktu widzenia legalności gospodarności działalność jednostek organizacyjnych podmiotów gospodarczych zakresie jakim wykorzystują majątek środki panstwo komunalne wywiązują zobowiązań finansowych rzecz panstwo
Art. 204.,najwyższa izba kontroli przedkłada sejmowi analizę wykonania budżetu panstwo założeń polityki pieniężnej opinię przedmiocie absolutorium rady ministrów informacje wynikach kontroli wnioski wystąpienia określone ustawa najwyższa izba kontroli przedstawia sejmowi coroczne sprawozdanie swojej działalności
Art. 205.,prezes najwyższej izby kontroli powoływany sejm zgodą senatu moze ponownie powołany prezes najwyższej izby kontroli nie moze zajmować innego stanowiska wyjątkiem stanowiska profesora szkoły wyższej wykonywać zajęć zawodowych ©kancelaria prezes najwyższej izby kontroli nie moze należeć partii politycznej związku zawodowego prowadzić działalności publicznej nie dającej pogodzić godnosc urzędu
Art. 206.,prezes najwyższej izby kontroli nie moze uprzedniej zgody pociągnięty odpowiedzialnosc karnej pozbawiony wolnosc prezes najwyższej izby kontroli nie moze zatrzymany aresztowany wyjątkiem ujęcia gorącym uczynku przestępstwa zatrzymanie niezbędne zapewnienia prawidłowego toku postępowania zatrzymaniu niezwłocznie powiadamia marszałka moze nakazać natychmiastowe zwolnienie zatrzymanego
Art. 207.,organizację tryb działania najwyższej izby kontroli określa ustawa rzecznik prawo obywatel
Art. 208.,rzecznik prawo obywatel stoi straży wolnosc prawo czlowiek obywatel określonych konstytucji aktach normatywnych zakres działania rzecznika prawo obywatel określa ustawa
Art. 209.,rzecznik prawo obywatel powoływany sejm zgodą senatu rzecznik prawo obywatel nie moze zajmować innego stanowiska wyjątkiem stanowiska profesora szkoły wyższej wykonywać zajęć zawodowych rzecznik prawo obywatel nie moze należeć partii politycznej związku zawodowego prowadzić działalności publicznej nie dającej pogodzić godnosc urzędu
Art. 210.,rzecznik prawo obywatel swojej działalności niezawisły niezależny organów panstwo odpowiedzialnosc sejmem zasadach określonych ustawa
Art. 211.,rzecznik prawo obywatel nie moze uprzedniej zgody pociągnięty odpowiedzialnosc karnej pozbawiony wolnosc rzecznik prawo obywatel nie moze zatrzymany aresztowany wyjątkiem ujęcia ©kancelaria gorącym uczynku przestępstwa zatrzymanie niezbędne zapewnienia prawidłowego toku postępowania zatrzymaniu niezwłocznie powiadamia marszałka moze nakazać natychmiastowe zwolnienie zatrzymanego
Art. 212.,rzecznik prawo obywatel corocznie informuje sejm senat swojej działalności stanie przestrzegania wolnosc prawo czlowiek obywatel krajowa rada radiofonii telewizji
Art. 213.,krajowa rada radiofonii telewizji stoi straży wolnosc słowa prawo informacji interesu publicznego radiofonii telewizji krajowa rada radiofonii telewizji wydaje rozporządzenia sprawach indywidualnych podejmuje uchwały
Art. 214.,członkowie krajowej rady radiofonii telewizji powoływani sejm senat prezydenta członek krajowej rady radiofonii telewizji nie moze należeć partii politycznej związku zawodowego prowadzić działalności publicznej nie dającej pogodzić godnosc pełnionej funkcji
Art. 215.,zasady tryb działania krajowej rady radiofonii telewizji organizację szczegółowe zasady powoływania członków określa ustawa rozdział finanse publiczne
Art. 216.,środki finansowe cele publiczne gromadzone wydatkowane określony ustawa nabywanie zbywanie obciążanie nieruchomości udziałów akcji emisja papierów wartościowych skarb panstwo narodowy bank panstwo osoby prawo następuje zasadach trybie określonych ustawa ustanowienie monopolu następuje drodze ustawa zaciąganie pożyczek udzielanie gwarancji poręczeń finansowych panstwo następuje zasadach trybie określonych ustawa ©kancelaria nie wolnosc zaciągać pożyczek udzielać gwarancji poręczeń finansowych następstwie panstwo dług publiczny przekroczy wartości rocznego produktu krajowego brutto obliczania wartości rocznego produktu krajowego brutto panstwo długu publicznego określa ustawa
Art. 217.,nakładanie podatków danin publicznych określanie podmiotów przedmiotów opodatkowania stawek podatkowych zasad przyznawania ulg umorzeń kategorii podmiotów zwolnionych podatków następuje drodze ustawa
Art. 218.,organizację skarbu panstwo zarządzania majątkiem skarbu panstwo określa ustawa
Art. 219.,sejm uchwala budżet panstwo rok budżetowy formie ustawa budżetowej zasady tryb opracowania projektu budżetu panstwo stopień szczegółowości wymagania musi odpowiadać projekt ustawa budżetowej zasady tryb wykonywania ustawa budżetowej określa ustawa wyjątkowych przypadkach dochody wydatki panstwo okresie krótszym rok moze określać ustawa prowizorium budżetowym przepisy dotyczące projektu ustawa budżetowej stosuje odpowiednio projektu ustawa prowizorium budżetowym ustawa budżetowa ustawa prowizorium budżetowym nie weszły życie dniu rozpoczęcia budżetowego rada ministrów prowadzi gospodarkę finansową przedłożonego projektu ustawa
Art. 220.,zwiększenie wydatków ograniczenie dochodów planowanych radę ministrów nie moze powodować ustalenia sejm większego deficytu budżetowego przewidziany projekcie ustawa budżetowej ustawa budżetowa nie moze przewidywać pokrywania deficytu budżetowego zaciąganie zobowiązania centralnym banku panstwo
Art. 221.,inicjatywa ustawodawcza zakresie ustawa budżetowej ustawa prowizorium budżetowym zmiany ustawa budżetowej ustawa zaciąganiu długu publicznego ustawa udzielaniu gwarancji finansowych panstwo przysługuje wyłącznie radzie ministrów ©kancelaria
Art. 222.,rada ministrów przedkłada sejmowi najpóźniej miesiące rozpoczęciem budżetowego projekt ustawa budżetowej rok następny wyjątkowych przypadkach późniejsze przedłożenie projektu
Art. 223.,senat moze uchwalić poprawki ustawa budżetowej ciągu dni przekazania senatowi
Art. 224.,prezydent podpisuje ciągu dni ustawę budżetową ustawę prowizorium budżetowym przedstawioną marszałka ustawa budżetowej ustawa prowizorium budżetowym nie stosuje przepisu przypadku zwrócenia prezydenta trybunal konstytucyjnego sprawie zgodności konstytucją ustawa budżetowej ustawa prowizorium budżetowym podpisaniem trybunal orzeka sprawie nie później ciągu miesięcy złożenia wniosku trybunale
Art. 225.,ciągu miesięcy przedłożenia sejmowi projektu ustawa budżetowej nie zostanie przedstawiona prezydentowi podpisu prezydent moze ciągu dni zarządzić skrócenie kadencji
Art. 226.,rada ministrów ciągu miesięcy zakończenia budżetowego przedkłada sejmowi sprawozdanie wykonania ustawa budżetowej wraz informacją stanie zadłużenia panstwo sejm rozpatruje przedłożone sprawozdanie zapoznaniu opinią najwyższej izby kontroli podejmuje ciągu dni przedłożenia sejmowi sprawozdania uchwałę udzieleniu odmowie udzielenia radzie ministrów absolutorium
